{
  "artifact_checks": {
    "candidates": {
      "bytes": 295508,
      "exists": true,
      "path": "<PROJECT_DIR>/examples/full-workflow-20260726/figure9-marker-v3/candidates.csv",
      "sha256": "ad4beba6cf9d85988e06e2f0efe2c9ba37b82c5f6ba433c88601a62ba892bc5e"
    },
    "data": {
      "bytes": 486836,
      "exists": true,
      "path": "<PROJECT_DIR>/examples/full-workflow-20260726/figure9-marker-v3/data.csv",
      "sha256": "f9b43413e32cd42c15338087df6a0377f8940e9d9dd1574eabc3895bc544d03b"
    },
    "extraction_report": {
      "bytes": 9225,
      "exists": true,
      "path": "<PROJECT_DIR>/examples/full-workflow-20260726/figure9-marker-v3/extraction-report.json",
      "sha256": "dfd6a622441378477ae1158f4b76108fb78207a9a06103e944191ab9918a4f74"
    },
    "formal_data_report": {
      "bytes": 3100,
      "exists": true,
      "path": "<PROJECT_DIR>/examples/full-workflow-20260726/figure9-marker-v3/formal-data-report.json",
      "sha256": "4dbff830946775ec14789b1918c9b481c1c015cdc51047b88dc04c0c84064941"
    },
    "observations": {
      "bytes": 336991,
      "exists": true,
      "path": "<PROJECT_DIR>/examples/full-workflow-20260726/figure9-marker-v3/observations.csv",
      "sha256": "f52d86860372bc2acf7c8e209dd7a191011d0b410f0539753f49095ba4159fc8"
    },
    "overlay": {
      "bytes": 238038,
      "exists": true,
      "path": "<PROJECT_DIR>/examples/full-workflow-20260726/figure9-marker-v3/overlay.png",
      "sha256": "4c7ea6efc671d62fe235a40fcea2d31094d246629c03904e14e1be02f0763a52"
    },
    "project_spec": {
      "bytes": 12406,
      "exists": true,
      "path": "<PROJECT_DIR>/examples/full-workflow-20260726/figure9-marker-v3/project.json",
      "sha256": "f02c29024cfc7df15ec773b961a21c3901488ae4e286d024d2bbbe97026692a6"
    },
    "render_pdf": {
      "bytes": 22431,
      "exists": true,
      "path": "<PROJECT_DIR>/examples/full-workflow-20260726/figure9-marker-v3/render/render.pdf",
      "sha256": "c27ae9690f29356ac25c83fc46f3cf2fcf64cf6f749226afd7afda5ca6b829a4"
    },
    "render_png": {
      "bytes": 112767,
      "exists": true,
      "path": "<PROJECT_DIR>/examples/full-workflow-20260726/figure9-marker-v3/render/render.png",
      "sha256": "eaf88e225110c2548a2c0e465942d9fe2dd4599898b93a9f6b41190a0eb11623"
    },
    "render_report": {
      "bytes": 2027,
      "exists": true,
      "path": "<PROJECT_DIR>/examples/full-workflow-20260726/figure9-marker-v3/render/render-report.json",
      "sha256": "4a64f8a0e0bb10e3b94be457544d9177ec7de2f19f613f0dbfafc3067f57c553"
    },
    "render_svg": {
      "bytes": 66879,
      "exists": true,
      "path": "<PROJECT_DIR>/examples/full-workflow-20260726/figure9-marker-v3/render/render.svg",
      "sha256": "6a1ded1dc349924ceaeb38329bbc42c49ff21868550ac40895162279281c21a1"
    },
    "review_decisions": {
      "bytes": 161674,
      "exists": true,
      "path": "<PROJECT_DIR>/examples/full-workflow-20260726/figure9-marker-v3/review-decisions.json",
      "sha256": "cdc06abca1b6a2c3b6923057052347cd945e9841670e6aa3472644c7098bc66c"
    }
  },
  "delivery_assessment": {
    "decision": "accepted",
    "dimension_floor_pass": true,
    "dimensions": {
      "artifact_integrity": {
        "label": "交付物与哈希完整性",
        "metrics": {
          "required_artifacts": 12,
          "verified_artifacts": 12
        },
        "score": 100.0,
        "weight": 30
      },
      "data_geometry_traceability": {
        "label": "数据到图形可追溯性",
        "metrics": {
          "declared_xy_mapping": true,
          "formal_data_present": true,
          "positive_rendered_rows": true,
          "project_spec_present": true,
          "render_report_pass": true
        },
        "score": 100.0,
        "weight": 25
      },
      "format_completeness": {
        "label": "PNG/SVG/PDF 格式完整性",
        "metrics": {
          "render_pdf": true,
          "render_png": true,
          "render_svg": true
        },
        "score": 100.0,
        "weight": 20
      },
      "render_spec_compliance": {
        "label": "重绘规格符合度",
        "metrics": {
          "canvas_matches_when_declared": true,
          "plot_type_matches": true,
          "x_mapping_matches": true,
          "x_scale_matches": true,
          "y_mapping_matches": true,
          "y_scale_matches": true
        },
        "score": 100.0,
        "weight": 25
      }
    },
    "hard_gates": {
      "artifact_hashes_valid": true,
      "required_formats_complete": true,
      "stage_status_allows_delivery": true
    },
    "hard_gates_pass": true,
    "method": "weighted_render_delivery_dimensions_with_non_compensable_hard_gates",
    "minimum_dimension_score": 100.0,
    "next_instruction": "重绘技术交付达到所选用途阈值；可接受当前版本，或按需进行视觉审美复核。",
    "overall_score": 100.0,
    "profile": "publication",
    "profile_label": "论文定量数据",
    "qualification_note": "此分数评价文件、哈希、格式、数据映射和规格执行；参考图像素残差仅用于定位差异，不等同于科研数据准确率或视觉审美评分。",
    "score_threshold_pass": true,
    "thresholds": {
      "minimum_dimension_score": 90.0,
      "overall_score": 95.0
    },
    "visual_reference_diagnostic": {
      "status": "not_run"
    },
    "worst_dimension": "artifact_integrity"
  },
  "delivery_status": "pass",
  "errors": [],
  "schema": "more-sci-figure.validation-report.v1",
  "stage_statuses": {
    "extraction_status": "pass",
    "render_status": "pass",
    "review_status": "accepted"
  },
  "status": "pass",
  "visual_comparison": {
    "status": "not_run"
  },
  "warnings": []
}
