{
  "artifact_checks": {
    "candidates": {
      "bytes": 85771,
      "exists": true,
      "path": "<PROJECT_DIR>/examples/full-workflow-20260726/figure10b-centerline-v2/candidates.csv",
      "sha256": "40eb9f3039b051c41b71ff9ed13d47706a0eae6d5014336c02a3ced75d1e1b84"
    },
    "data": {
      "bytes": 140530,
      "exists": true,
      "path": "<PROJECT_DIR>/examples/full-workflow-20260726/figure10b-centerline-v2/data.csv",
      "sha256": "89a2b5f90795d6ac7ae97ba0170bbe4ecad6e39572ab16cf3d16d1c026714f34"
    },
    "extraction_report": {
      "bytes": 5938,
      "exists": true,
      "path": "<PROJECT_DIR>/examples/full-workflow-20260726/figure10b-centerline-v2/extraction-report.json",
      "sha256": "1eb3b8252e36678673197b0e07138a362ff60f6af683212b4e1a07904e384ab7"
    },
    "formal_data_report": {
      "bytes": 1741,
      "exists": true,
      "path": "<PROJECT_DIR>/examples/full-workflow-20260726/figure10b-centerline-v2/formal-data-report.json",
      "sha256": "733bf9598fdc37c8a48ceacb047501491dd3ea5be366f1e73f2cf28471ed62bc"
    },
    "observations": {
      "bytes": 95533,
      "exists": true,
      "path": "<PROJECT_DIR>/examples/full-workflow-20260726/figure10b-centerline-v2/observations.csv",
      "sha256": "a74c78277263a56184e0d4a71d0a7cd363c46138f85db912904601912f3828d2"
    },
    "overlay": {
      "bytes": 52077,
      "exists": true,
      "path": "<PROJECT_DIR>/examples/full-workflow-20260726/figure10b-centerline-v2/overlay.png",
      "sha256": "d972fa97bcd7a43f53b2c5ce4293fa691ed4e277b244ec748487da7669a8f34d"
    },
    "project_spec": {
      "bytes": 4067,
      "exists": true,
      "path": "<PROJECT_DIR>/examples/full-workflow-20260726/figure10b-centerline-v2/project.json",
      "sha256": "f2d51afd74e786354b4933cf06ed5bad175d73a3199b40e2f0b349bf17f63753"
    },
    "render_pdf": {
      "bytes": 19953,
      "exists": true,
      "path": "<PROJECT_DIR>/examples/full-workflow-20260726/figure10b-centerline-v2/render/render.pdf",
      "sha256": "5d6feae2e883d646dc487d03722ae4de7a51da4311925a85118acd09d5078459"
    },
    "render_png": {
      "bytes": 199049,
      "exists": true,
      "path": "<PROJECT_DIR>/examples/full-workflow-20260726/figure10b-centerline-v2/render/render.png",
      "sha256": "370de4bf10272865d604af1d744395a55d9022bccba70a6650bf1d3868de77ad"
    },
    "render_report": {
      "bytes": 1732,
      "exists": true,
      "path": "<PROJECT_DIR>/examples/full-workflow-20260726/figure10b-centerline-v2/render/render-report.json",
      "sha256": "521409bff3e479757a3977c2b43f3f0fd814a625176ff9c18195e6287ce9679e"
    },
    "render_svg": {
      "bytes": 65485,
      "exists": true,
      "path": "<PROJECT_DIR>/examples/full-workflow-20260726/figure10b-centerline-v2/render/render.svg",
      "sha256": "c1823bb438232661cd052b7c449fde89b8b6391136d454387df6aded68155534"
    },
    "review_decisions": {
      "bytes": 51008,
      "exists": true,
      "path": "<PROJECT_DIR>/examples/full-workflow-20260726/figure10b-centerline-v2/review-decisions.json",
      "sha256": "c53e3720b13ff59738e08cdb60b0f29cdd0792ea38980537fdeae5e55882047e"
    }
  },
  "delivery_assessment": {
    "decision": "accepted",
    "dimension_floor_pass": true,
    "dimensions": {
      "artifact_integrity": {
        "label": "交付物与哈希完整性",
        "metrics": {
          "required_artifacts": 12,
          "verified_artifacts": 12
        },
        "score": 100.0,
        "weight": 30
      },
      "data_geometry_traceability": {
        "label": "数据到图形可追溯性",
        "metrics": {
          "declared_xy_mapping": true,
          "formal_data_present": true,
          "positive_rendered_rows": true,
          "project_spec_present": true,
          "render_report_pass": true
        },
        "score": 100.0,
        "weight": 25
      },
      "format_completeness": {
        "label": "PNG/SVG/PDF 格式完整性",
        "metrics": {
          "render_pdf": true,
          "render_png": true,
          "render_svg": true
        },
        "score": 100.0,
        "weight": 20
      },
      "render_spec_compliance": {
        "label": "重绘规格符合度",
        "metrics": {
          "canvas_matches_when_declared": true,
          "plot_type_matches": true,
          "x_mapping_matches": true,
          "x_scale_matches": true,
          "y_mapping_matches": true,
          "y_scale_matches": true
        },
        "score": 100.0,
        "weight": 25
      }
    },
    "hard_gates": {
      "artifact_hashes_valid": true,
      "required_formats_complete": true,
      "stage_status_allows_delivery": true
    },
    "hard_gates_pass": true,
    "method": "weighted_render_delivery_dimensions_with_non_compensable_hard_gates",
    "minimum_dimension_score": 100.0,
    "next_instruction": "重绘技术交付达到所选用途阈值；可接受当前版本，或按需进行视觉审美复核。",
    "overall_score": 100.0,
    "profile": "publication",
    "profile_label": "论文定量数据",
    "qualification_note": "此分数评价文件、哈希、格式、数据映射和规格执行；参考图像素残差仅用于定位差异，不等同于科研数据准确率或视觉审美评分。",
    "score_threshold_pass": true,
    "thresholds": {
      "minimum_dimension_score": 90.0,
      "overall_score": 95.0
    },
    "visual_reference_diagnostic": {
      "status": "not_run"
    },
    "worst_dimension": "artifact_integrity"
  },
  "delivery_status": "pass",
  "errors": [],
  "schema": "more-sci-figure.validation-report.v1",
  "stage_statuses": {
    "extraction_status": "pass",
    "render_status": "pass",
    "review_status": "accepted"
  },
  "status": "pass",
  "visual_comparison": {
    "status": "not_run"
  },
  "warnings": []
}
