{
  "artifact_checks": {
    "candidates": {
      "bytes": 209308,
      "exists": true,
      "path": "<PROJECT_DIR>/examples/full-workflow-20260726/figure7-marker-v4/candidates.csv",
      "sha256": "82ad14c785acd0bc93ecab20347d3a6d0f504541e854739c49aba64ce967d7dd"
    },
    "data": {
      "bytes": 381085,
      "exists": true,
      "path": "<PROJECT_DIR>/examples/full-workflow-20260726/figure7-marker-v4/data.csv",
      "sha256": "34093db00ab70746b29f9c9167aec03c8e7e93b65a23b922427d3a6acc25839f"
    },
    "extraction_report": {
      "bytes": 9227,
      "exists": true,
      "path": "<PROJECT_DIR>/examples/full-workflow-20260726/figure7-marker-v4/extraction-report.json",
      "sha256": "e6f6910ff19eda02fc8a89079ea3da69925a492ece1d8fcb3e33a32534b9ab11"
    },
    "formal_data_report": {
      "bytes": 3090,
      "exists": true,
      "path": "<PROJECT_DIR>/examples/full-workflow-20260726/figure7-marker-v4/formal-data-report.json",
      "sha256": "3c988c06635692347dcbfb0a935d2b6e23d8f3670777efd6c65ed33a5ecfeaa7"
    },
    "observations": {
      "bytes": 239742,
      "exists": true,
      "path": "<PROJECT_DIR>/examples/full-workflow-20260726/figure7-marker-v4/observations.csv",
      "sha256": "82e3b615da6245f066e08f065d773c3287f759624a85e9f7951e0879d3b0be56"
    },
    "overlay": {
      "bytes": 217724,
      "exists": true,
      "path": "<PROJECT_DIR>/examples/full-workflow-20260726/figure7-marker-v4/overlay.png",
      "sha256": "5dd3c71b52030d11601e1c29247d7e61e00c9bc00b963ff84f4110ca1ebdcacf"
    },
    "project_spec": {
      "bytes": 12806,
      "exists": true,
      "path": "<PROJECT_DIR>/examples/full-workflow-20260726/figure7-marker-v4/project.json",
      "sha256": "33929fbafe41ec9fedf8fdd4cd96b26960a51736bfe944653a9241ac85a27484"
    },
    "render_pdf": {
      "bytes": 18047,
      "exists": true,
      "path": "<PROJECT_DIR>/examples/full-workflow-20260726/figure7-marker-v4/render/render.pdf",
      "sha256": "01c23615cff08a0b8c06edc259a9644863446e737d9016ad0984efed1a72bae9"
    },
    "render_png": {
      "bytes": 87778,
      "exists": true,
      "path": "<PROJECT_DIR>/examples/full-workflow-20260726/figure7-marker-v4/render/render.png",
      "sha256": "e11c83a6e494532fd90c9a802c248898d5d6d3726da056f948ae0b1384e2f902"
    },
    "render_report": {
      "bytes": 2048,
      "exists": true,
      "path": "<PROJECT_DIR>/examples/full-workflow-20260726/figure7-marker-v4/render/render-report.json",
      "sha256": "51438248b98eae1cc308fcf0eadf41137a977657da07169ee3c0374de73f8f01"
    },
    "render_svg": {
      "bytes": 53145,
      "exists": true,
      "path": "<PROJECT_DIR>/examples/full-workflow-20260726/figure7-marker-v4/render/render.svg",
      "sha256": "efba398c895a818360a38c15da92fba61a056fc0d5c9784d4b0a317715413283"
    },
    "review_decisions": {
      "bytes": 117882,
      "exists": true,
      "path": "<PROJECT_DIR>/examples/full-workflow-20260726/figure7-marker-v4/review-decisions.json",
      "sha256": "de6458cb22d1b27cfbf8f7c36bb488d9b57e10715245a1ec775e2a8b43a882b4"
    }
  },
  "delivery_assessment": {
    "decision": "accepted",
    "dimension_floor_pass": true,
    "dimensions": {
      "artifact_integrity": {
        "label": "交付物与哈希完整性",
        "metrics": {
          "required_artifacts": 12,
          "verified_artifacts": 12
        },
        "score": 100.0,
        "weight": 30
      },
      "data_geometry_traceability": {
        "label": "数据到图形可追溯性",
        "metrics": {
          "declared_xy_mapping": true,
          "formal_data_present": true,
          "positive_rendered_rows": true,
          "project_spec_present": true,
          "render_report_pass": true
        },
        "score": 100.0,
        "weight": 25
      },
      "format_completeness": {
        "label": "PNG/SVG/PDF 格式完整性",
        "metrics": {
          "render_pdf": true,
          "render_png": true,
          "render_svg": true
        },
        "score": 100.0,
        "weight": 20
      },
      "render_spec_compliance": {
        "label": "重绘规格符合度",
        "metrics": {
          "canvas_matches_when_declared": true,
          "plot_type_matches": true,
          "x_mapping_matches": true,
          "x_scale_matches": true,
          "y_mapping_matches": true,
          "y_scale_matches": true
        },
        "score": 100.0,
        "weight": 25
      }
    },
    "hard_gates": {
      "artifact_hashes_valid": true,
      "required_formats_complete": true,
      "stage_status_allows_delivery": true
    },
    "hard_gates_pass": true,
    "method": "weighted_render_delivery_dimensions_with_non_compensable_hard_gates",
    "minimum_dimension_score": 100.0,
    "next_instruction": "重绘技术交付达到所选用途阈值；可接受当前版本，或按需进行视觉审美复核。",
    "overall_score": 100.0,
    "profile": "publication",
    "profile_label": "论文定量数据",
    "qualification_note": "此分数评价文件、哈希、格式、数据映射和规格执行；参考图像素残差仅用于定位差异，不等同于科研数据准确率或视觉审美评分。",
    "score_threshold_pass": true,
    "thresholds": {
      "minimum_dimension_score": 90.0,
      "overall_score": 95.0
    },
    "visual_reference_diagnostic": {
      "status": "not_run"
    },
    "worst_dimension": "artifact_integrity"
  },
  "delivery_status": "pass",
  "errors": [],
  "schema": "more-sci-figure.validation-report.v1",
  "stage_statuses": {
    "extraction_status": "pass",
    "render_status": "pass",
    "review_status": "accepted"
  },
  "status": "pass",
  "visual_comparison": {
    "status": "not_run"
  },
  "warnings": []
}
