{
  "artifact_checks": {
    "candidates": {
      "bytes": 284453,
      "exists": true,
      "path": "<PROJECT_DIR>/examples/full-workflow-20260726/figure10a-centerline-v2/candidates.csv",
      "sha256": "3436bc89f5ba1ab1ff7581ba5a7d655daac4cb2ac1bc53357ddd5f6124abc8a9"
    },
    "data": {
      "bytes": 560611,
      "exists": true,
      "path": "<PROJECT_DIR>/examples/full-workflow-20260726/figure10a-centerline-v2/data.csv",
      "sha256": "f01dddd2f216e036876b2216fa817141c84f704ff627936372b5c26f135f6936"
    },
    "extraction_report": {
      "bytes": 7515,
      "exists": true,
      "path": "<PROJECT_DIR>/examples/full-workflow-20260726/figure10a-centerline-v2/extraction-report.json",
      "sha256": "51f01e1f73893bc8ffcd1d9964e2890dccb470d9236c6160170d94857e5d380a"
    },
    "formal_data_report": {
      "bytes": 2529,
      "exists": true,
      "path": "<PROJECT_DIR>/examples/full-workflow-20260726/figure10a-centerline-v2/formal-data-report.json",
      "sha256": "e49c946af05259c36088204b3647cc2b115f0010896ec2681950299d9c7b698a"
    },
    "observations": {
      "bytes": 345677,
      "exists": true,
      "path": "<PROJECT_DIR>/examples/full-workflow-20260726/figure10a-centerline-v2/observations.csv",
      "sha256": "823978545eea39f06348b11f75694f78c7ef52c43cc25722bbc8d2b04fa107fe"
    },
    "overlay": {
      "bytes": 230208,
      "exists": true,
      "path": "<PROJECT_DIR>/examples/full-workflow-20260726/figure10a-centerline-v2/overlay.png",
      "sha256": "750955d74bb32ba96c1f7fbd9ab605df37af8646a6190a3de91cfe392d8aa9c3"
    },
    "project_spec": {
      "bytes": 5312,
      "exists": true,
      "path": "<PROJECT_DIR>/examples/full-workflow-20260726/figure10a-centerline-v2/project.json",
      "sha256": "0011519c93f3e3ed96f24c486e61002c7047eac2ee1113d29633a7d22f7cf2c2"
    },
    "render_pdf": {
      "bytes": 25679,
      "exists": true,
      "path": "<PROJECT_DIR>/examples/full-workflow-20260726/figure10a-centerline-v2/render/render.pdf",
      "sha256": "4df73ef3f41edb2b6331f937a99f97fc1dea42eb591db53d4da9a8782d924dc7"
    },
    "render_png": {
      "bytes": 170513,
      "exists": true,
      "path": "<PROJECT_DIR>/examples/full-workflow-20260726/figure10a-centerline-v2/render/render.png",
      "sha256": "1947f399a2a532ec61e35eed5edb95e4274d930c4efeab6786714b72c6860368"
    },
    "render_report": {
      "bytes": 1818,
      "exists": true,
      "path": "<PROJECT_DIR>/examples/full-workflow-20260726/figure10a-centerline-v2/render/render-report.json",
      "sha256": "508b5e5ed4dd7db3806981f4c236ff76d23356a3813fc3f20aa95a51726923a6"
    },
    "render_svg": {
      "bytes": 73958,
      "exists": true,
      "path": "<PROJECT_DIR>/examples/full-workflow-20260726/figure10a-centerline-v2/render/render.svg",
      "sha256": "feb86ef54f0b6c02ca15a3a0625a8d485ea54c5390556442533080d76da625d0"
    },
    "review_decisions": {
      "bytes": 232462,
      "exists": true,
      "path": "<PROJECT_DIR>/examples/full-workflow-20260726/figure10a-centerline-v2/review-decisions.json",
      "sha256": "3ff2ca45071c90051657d7cd666272784da3bdf1541a8fb3b5bde00bf080b6f5"
    }
  },
  "delivery_assessment": {
    "decision": "accepted",
    "dimension_floor_pass": true,
    "dimensions": {
      "artifact_integrity": {
        "label": "交付物与哈希完整性",
        "metrics": {
          "required_artifacts": 12,
          "verified_artifacts": 12
        },
        "score": 100.0,
        "weight": 30
      },
      "data_geometry_traceability": {
        "label": "数据到图形可追溯性",
        "metrics": {
          "declared_xy_mapping": true,
          "formal_data_present": true,
          "positive_rendered_rows": true,
          "project_spec_present": true,
          "render_report_pass": true
        },
        "score": 100.0,
        "weight": 25
      },
      "format_completeness": {
        "label": "PNG/SVG/PDF 格式完整性",
        "metrics": {
          "render_pdf": true,
          "render_png": true,
          "render_svg": true
        },
        "score": 100.0,
        "weight": 20
      },
      "render_spec_compliance": {
        "label": "重绘规格符合度",
        "metrics": {
          "canvas_matches_when_declared": true,
          "plot_type_matches": true,
          "x_mapping_matches": true,
          "x_scale_matches": true,
          "y_mapping_matches": true,
          "y_scale_matches": true
        },
        "score": 100.0,
        "weight": 25
      }
    },
    "hard_gates": {
      "artifact_hashes_valid": true,
      "required_formats_complete": true,
      "stage_status_allows_delivery": true
    },
    "hard_gates_pass": true,
    "method": "weighted_render_delivery_dimensions_with_non_compensable_hard_gates",
    "minimum_dimension_score": 100.0,
    "next_instruction": "重绘技术交付达到所选用途阈值；可接受当前版本，或按需进行视觉审美复核。",
    "overall_score": 100.0,
    "profile": "publication",
    "profile_label": "论文定量数据",
    "qualification_note": "此分数评价文件、哈希、格式、数据映射和规格执行；参考图像素残差仅用于定位差异，不等同于科研数据准确率或视觉审美评分。",
    "score_threshold_pass": true,
    "thresholds": {
      "minimum_dimension_score": 90.0,
      "overall_score": 95.0
    },
    "visual_reference_diagnostic": {
      "status": "not_run"
    },
    "worst_dimension": "artifact_integrity"
  },
  "delivery_status": "pass",
  "errors": [],
  "schema": "more-sci-figure.validation-report.v1",
  "stage_statuses": {
    "extraction_status": "pass",
    "render_status": "pass",
    "review_status": "accepted"
  },
  "status": "pass",
  "visual_comparison": {
    "status": "not_run"
  },
  "warnings": []
}
